{"$schema":"https://json-schema.org/draft/2020-12/schema","title":"Provider Choice State v0.4","type":"object","required":["schema_version","mode","status","available_providers","detected_providers","prompt_only_providers","manual_web_providers","direct_api_providers","local_api_providers","recommended_provider","selected_provider","fallback_provider","reason","warnings","next_actions","prompt_only","installation_policy"],"properties":{"schema_version":{"const":"0.4.0"},"mode":{"const":"auto"},"status":{"enum":["configured-unverified","prompt-workflow-ready"]},"available_providers":{"type":"array"},"detected_providers":{"type":"array"},"prompt_only_providers":{"type":"array"},"manual_web_providers":{"type":"array"},"direct_api_providers":{"type":"array"},"local_api_providers":{"type":"array"},"recommended_provider":{"type":"string"},"selected_provider":{"type":"string"},"fallback_provider":{"const":"placeholder-svg"},"reason":{"type":"string"},"warnings":{"type":"array"},"next_actions":{"type":"array"},"prompt_only":{"type":"boolean"},"installation_policy":{"type":"string"}}}
